{"$id":"tiber-forecast:fantasy_forecast.weekly_player_request:1.0.0","$schema":"https://json-schema.org/draft/2020-12/schema","additionalProperties":false,"description":"Canonical weekly player-card scoring request from TIBER-Fantasy to TIBER-Forecast. Unknown fields are REJECTED (fail closed). Optional opportunity fields are OMITTED when unsampled — null is never a valid field value, and 0 always means an observed zero. ROS fields (remaining_weeks) are mechanically excluded from the weekly horizon.","properties":{"comparison_pool":{"items":{"additionalProperties":false,"properties":{"air_yards_per_target":{"maximum":60,"minimum":-20,"type":"number"},"carries_pg":{"maximum":100,"minimum":0,"type":"number"},"catch_rate":{"maximum":1,"minimum":0,"type":"number"},"designed_rush_attempts_pg":{"maximum":100,"minimum":0,"type":"number"},"end_zone_targets_pg":{"maximum":100,"minimum":0,"type":"number"},"first_read_target_share":{"maximum":1,"minimum":0,"type":"number"},"games_sampled":{"maximum":30,"minimum":0,"type":"integer"},"goal_line_rush_attempts_pg":{"maximum":100,"minimum":0,"type":"number"},"injury_risk":{"maximum":1,"minimum":0,"type":"number"},"inside_10_carries_pg":{"maximum":100,"minimum":0,"type":"number"},"interception_rate":{"maximum":1,"minimum":0,"type":"number"},"pass_attempts_pg":{"maximum":100,"minimum":0,"type":"number"},"pass_td_rate":{"maximum":1,"minimum":0,"type":"number"},"pass_yards_per_attempt":{"maximum":60,"minimum":-20,"type":"number"},"player_id":{"minLength":1,"type":"string"},"player_name":{"minLength":1,"type":"string"},"position":{"enum":["QB","RB","WR","TE"],"type":"string"},"receiving_role_strength":{"maximum":1,"minimum":0,"type":"number"},"receiving_td_rate":{"maximum":1,"minimum":0,"type":"number"},"red_zone_target_share":{"maximum":1,"minimum":0,"type":"number"},"role_stability":{"maximum":1,"minimum":0,"type":"number"},"route_participation":{"maximum":1,"minimum":0,"type":"number"},"routes_pg":{"maximum":100,"minimum":0,"type":"number"},"rush_attempts_pg":{"maximum":100,"minimum":0,"type":"number"},"rush_td_opportunity":{"maximum":1,"minimum":0,"type":"number"},"rush_td_rate":{"maximum":1,"minimum":0,"type":"number"},"rush_yards_per_attempt":{"maximum":60,"minimum":-20,"type":"number"},"scramble_rush_attempts_pg":{"maximum":100,"minimum":0,"type":"number"},"season":{"maximum":2100,"minimum":2000,"type":"integer"},"targets_per_route":{"maximum":1,"minimum":0,"type":"number"},"targets_pg":{"maximum":100,"minimum":0,"type":"number"},"td_dependency":{"maximum":1,"minimum":0,"type":"number"},"team":{"minLength":1,"type":"string"},"week":{"maximum":18,"minimum":1,"type":"integer"},"yards_per_carry":{"maximum":60,"minimum":-20,"type":"number"},"yards_per_reception":{"maximum":60,"minimum":-20,"type":"number"},"yards_per_target":{"maximum":60,"minimum":-20,"type":"number"}},"required":["player_id","player_name","team","position","games_sampled"],"title":"PlayerOpportunityInput (weekly, v1)","type":"object"},"type":"array"},"contract":{"const":"fantasy_forecast.weekly_player_request"},"contract_version":{"const":"1.0.0"},"horizon":{"const":"weekly"},"league_context":{"additionalProperties":false,"properties":{"flex_allocation":{"additionalProperties":false,"properties":{"RB":{"maximum":1,"minimum":0,"type":"number"},"TE":{"maximum":1,"minimum":0,"type":"number"},"WR":{"maximum":1,"minimum":0,"type":"number"}},"type":"object"},"replacement_buffer":{"maximum":1,"minimum":0,"type":"number"},"starters":{"additionalProperties":false,"properties":{"FLEX":{"maximum":10,"minimum":0,"type":"integer"},"QB":{"maximum":10,"minimum":0,"type":"integer"},"RB":{"maximum":10,"minimum":0,"type":"integer"},"TE":{"maximum":10,"minimum":0,"type":"integer"},"WR":{"maximum":10,"minimum":0,"type":"integer"}},"required":["QB","RB","WR","TE"],"type":"object"},"teams":{"maximum":32,"minimum":2,"type":"integer"}},"required":["teams","starters"],"title":"LeagueContextInput (v1)","type":"object"},"players":{"items":{"additionalProperties":false,"properties":{"air_yards_per_target":{"maximum":60,"minimum":-20,"type":"number"},"carries_pg":{"maximum":100,"minimum":0,"type":"number"},"catch_rate":{"maximum":1,"minimum":0,"type":"number"},"designed_rush_attempts_pg":{"maximum":100,"minimum":0,"type":"number"},"end_zone_targets_pg":{"maximum":100,"minimum":0,"type":"number"},"first_read_target_share":{"maximum":1,"minimum":0,"type":"number"},"games_sampled":{"maximum":30,"minimum":0,"type":"integer"},"goal_line_rush_attempts_pg":{"maximum":100,"minimum":0,"type":"number"},"injury_risk":{"maximum":1,"minimum":0,"type":"number"},"inside_10_carries_pg":{"maximum":100,"minimum":0,"type":"number"},"interception_rate":{"maximum":1,"minimum":0,"type":"number"},"pass_attempts_pg":{"maximum":100,"minimum":0,"type":"number"},"pass_td_rate":{"maximum":1,"minimum":0,"type":"number"},"pass_yards_per_attempt":{"maximum":60,"minimum":-20,"type":"number"},"player_id":{"minLength":1,"type":"string"},"player_name":{"minLength":1,"type":"string"},"position":{"enum":["QB","RB","WR","TE"],"type":"string"},"receiving_role_strength":{"maximum":1,"minimum":0,"type":"number"},"receiving_td_rate":{"maximum":1,"minimum":0,"type":"number"},"red_zone_target_share":{"maximum":1,"minimum":0,"type":"number"},"role_stability":{"maximum":1,"minimum":0,"type":"number"},"route_participation":{"maximum":1,"minimum":0,"type":"number"},"routes_pg":{"maximum":100,"minimum":0,"type":"number"},"rush_attempts_pg":{"maximum":100,"minimum":0,"type":"number"},"rush_td_opportunity":{"maximum":1,"minimum":0,"type":"number"},"rush_td_rate":{"maximum":1,"minimum":0,"type":"number"},"rush_yards_per_attempt":{"maximum":60,"minimum":-20,"type":"number"},"scramble_rush_attempts_pg":{"maximum":100,"minimum":0,"type":"number"},"season":{"maximum":2100,"minimum":2000,"type":"integer"},"targets_per_route":{"maximum":1,"minimum":0,"type":"number"},"targets_pg":{"maximum":100,"minimum":0,"type":"number"},"td_dependency":{"maximum":1,"minimum":0,"type":"number"},"team":{"minLength":1,"type":"string"},"week":{"maximum":18,"minimum":1,"type":"integer"},"yards_per_carry":{"maximum":60,"minimum":-20,"type":"number"},"yards_per_reception":{"maximum":60,"minimum":-20,"type":"number"},"yards_per_target":{"maximum":60,"minimum":-20,"type":"number"}},"required":["player_id","player_name","team","position","games_sampled"],"title":"PlayerOpportunityInput (weekly, v1)","type":"object"},"maxItems":1,"minItems":1,"type":"array"},"remaining_weeks":false,"replacement_points_override":{"additionalProperties":false,"properties":{"QB":{"maximum":100,"minimum":0,"type":"number"},"RB":{"maximum":100,"minimum":0,"type":"number"},"TE":{"maximum":100,"minimum":0,"type":"number"},"WR":{"maximum":100,"minimum":0,"type":"number"}},"type":"object"},"scoring_mode":false,"scoring_profile":{"const":"tiber-generic-full-ppr-v1"},"season":{"maximum":2100,"minimum":2000,"type":"integer"},"week":{"maximum":18,"minimum":1,"type":"integer"}},"required":["contract","contract_version","horizon","season","week","scoring_profile","players","league_context"],"title":"FantasyForecastWeeklyPlayerRequestV1","type":"object"}
