{"contract":"fantasy_forecast.weekly_player_request","contract_version":"1.0.0","horizon":"weekly","league_context":{"flex_allocation":{"RB":0.35,"TE":0.2,"WR":0.45},"replacement_buffer":0.1,"starters":{"FLEX":1,"QB":1,"RB":2,"TE":1,"WR":3},"teams":12},"players":[{"air_yards_per_target":9.1,"catch_rate":0.66,"end_zone_targets_pg":0.8,"games_sampled":16,"goal_line_rush_attempts_pg":0,"player_id":"TIBER-FIXTURE-WR-0001","player_name":"Fixture Wideout","position":"WR","receiving_td_rate":0.05,"red_zone_target_share":0.21,"role_stability":0.74,"route_participation":0.86,"routes_pg":34,"season":2026,"targets_per_route":0.24,"targets_pg":8.2,"team":"TST","week":1,"yards_per_target":8.4}],"scoring_profile":"tiber-generic-full-ppr-v1","season":2026,"week":1}
